MCQ,Choices,Correct
Who coined the term 'machine learning'?,A: Arthur Samuel | B: Donald Hebb | C: Walter Pitts | D: Warren McCulloch,A
In which year was the term 'machine learning' coined?,A: 1950 | B: 1959 | C: 1960 | D: 1973,B
Which book introduced a theoretical neural structure formed by certain interactions among nerve cells?,A: The Organization of Behavior | B: Learning Machines | C: Computing Machinery and Intelligence | D: Research into Machine Learning,A
What was the purpose of the Cybertron machine developed by Raytheon Company?,A: To analyze sonar signals | B: To analyze electrocardiograms | C: To analyze speech patterns | D: All of the above,D
What are the two objectives of modern-day machine learning?,A: To classify data and make predictions | B: To analyze sonar signals and electrocardiograms | C: To study human cognitive processes | D: To develop theoretical neural structures,A
